{"schema_name":"production-task-envelope","schema_version":"1.0.0","kernel_version":"2.0.0","run_id":"0123456789abcdef0123456789abcdef","task_id":"11111111111111111111111111111111","logical_task_key":"outline","role":"outline","claim_generation":1,"claim_token":"22222222222222222222222222222222","input_generations":[{"logical_id":"source_manifest","generation":1,"sha256":"aaaaaaaaaaaaaaaaaaaaaaaaaaaaaaaaaaaaaaaaaaaaaaaaaaaaaaaaaaaaaaaa"}],"write_set":["work/outline/outline.json"],"required_outputs":["outline.json"]}
